id,title,category_name,city,state,website,phone,total_score,permanently_closed,temporarily_closed,categories,created_at,updated_at,description,music_focus,capacity_min,capacity_max,booking_email,is_verified_music_venue,slug,rejected,venue_type
6bc14caa-3495-4a0d-b2a3-07e81ab651ed,Motorco,Music Venue,Durham,NC,https://motorcomusic.com/,919.901.0875,null,false,false,"[""Live Music"",""Bar""]",2025-10-30 15:56:25.365973+00,2025-11-03 00:14:36.817891+00,"Motorco Music Hall is an entertainment and events space in Durham, North Carolina. Motorco consists of a large, state of the art Showroom, the Garage Bar and restaurant Parts & Labor with a giant outdoor patio and the Veranda, a covered patio with its own bar and a Parrilla. We have full NC Liquor licenses and have a wide variety of beers, liquors, wines and specialty cocktails (fresh squeezed juices, housemade syrups!). We are located in the Central Park district, within short walking distance to the restaurants and bars of Downtown.","[""original""]",null,400,artist@motorcomusic.com,true,motorco,false,bar
2342d164-fee7-4f3b-8ce0-c06d74b69635,Sidecar,Music Venue,Barcelona,null,https://www.sidecarfactoryclub.com,+34 933 02 15 86,4.5,false,false,"[""Music Venue"",""Club""]",2025-10-08 18:39:57.106945+00,2025-11-03 00:14:36.817891+00,Intimate Barcelona venue in Plaça Reial featuring indie and alternative acts.,"[""original""]",200,300,info@sidecarfactoryclub.com,true,sidecar,false,venue
45eb8648-13d7-46de-9369-2e4531e813ea,Sala Caracol,Music Venue,Madrid,null,https://www.salacaracol.com,+34 914 27 39 94,4.5,false,false,"[""Music Venue"",""Nightclub""]",2025-10-08 18:39:57.106945+00,2025-11-03 00:14:36.817891+00,Madrid rock venue featuring local and touring acts.,"[""original""]",800,1000,info@salacaracol.com,true,sala-caracol,false,venue
e1fe7a2b-bf66-46ff-bacf-89ed5930dd6e,El Sol,Music Venue,Madrid,null,https://www.elsolmadrid.com,+34 915 32 64 90,4.6,false,false,"[""Music Venue"",""Nightclub""]",2025-10-08 18:39:57.106945+00,2025-11-03 00:14:36.817891+00,Legendary Madrid venue in Malasaña hosting indie and alternative acts.,"[""original""]",400,600,info@elsolmadrid.com,true,el-sol,false,venue
ff51d9b7-76d2-49ef-89a7-12a754a91604,Huxley's / Neue Welt,Music Venue,Berlin,null,https://www.huxleys-neue-welt.de,+49 30 230 89 30,4.6,false,false,"[""Music Venue"",""Concert Hall""]",2025-10-08 18:39:57.106945+00,2025-11-03 00:14:36.817891+00,Berlin venue hosting rock and metal acts.,"[""original""]",1500,1800,info@huxleys-neue-welt.de,true,huxleys-neue-welt,false,venue
2f0ef4d6-9f0a-45c0-bc9d-792570852dc3,Privatclub,Music Venue,Berlin,null,https://www.privatclub-berlin.de,+49 30 200 549 81,4.4,false,false,"[""Music Venue"",""Club""]",2025-10-08 18:39:57.106945+00,2025-11-03 00:14:36.817891+00,Berlin venue hosting electronic and indie music.,"[""original""]",400,600,info@privatclub.de,true,privatclub,false,venue
c8f5ba76-164a-4aba-acf5-aec095f0f128,Badehaus,Music Venue,Berlin,null,https://www.badehausberlin.de,+49 30 293 679 84,4.4,false,false,"[""Music Venue"",""Event Space""]",2025-10-08 18:39:57.106945+00,2025-11-03 00:14:36.817891+00,Berlin venue in Friedrichshain hosting concerts and events.,"[""original""]",300,500,info@badehausberlin.de,true,badehaus,false,venue
d2604d77-ff22-4298-8836-38e7a5b3a303,The Bedford,Music Venue,London,null,https://www.thebedford.co.uk,+44 20 8682 8940,4.5,false,false,"[""Music Venue"",""Pub""]",2025-10-08 18:39:57.106945+00,2025-11-03 00:14:36.817891+00,Balham pub and music venue hosting emerging acts.,"[""original""]",200,300,info@thebedford.co.uk,true,the-bedford,false,venue
ffc9339b-258b-4484-a714-3bf5964355b4,Supersonic,Music Venue,Paris,null,https://www.supersonic-club.fr,+33 1 46 06 68 20,4.5,false,false,"[""Music Venue"",""Club""]",2025-10-08 18:39:57.106945+00,2025-11-03 00:14:36.817891+00,Paris venue hosting rock and electronic music.,"[""original""]",400,600,info@supersonic-club.fr,true,supersonic,false,venue
fcfc65b7-8cfd-4f1a-a16c-b1073a386e97,Steel String Brewery,Brewery,Carrboro,NC,https://www.steelstringbrewery.com,919-240-7215,4.4,false,false,"[""Brewery"",""Music Venue""]",2025-10-08 18:39:15.619611+00,2025-11-03 00:14:36.817891+00,Craft brewery with regular live music performances.,"[""singer songwriter""]",75,125,info@steelstringbrewery.com,true,steel-string-brewery,false,brewery
68c132da-8970-4a5d-a1b6-9ae7ad00fd89,Bond Brothers Eastside,Brewery,Cary,NC,https://www.bondbrothersbeer.com,919-342-2739,4.3,false,false,"[""Brewery"",""Music Venue""]",2025-10-08 18:39:15.619611+00,2025-11-03 00:14:36.817891+00,Eastside location of Bond Brothers featuring live music and events.,"[""singer songwriter""]",100,200,events@bondbrothersbeer.com,true,bond-brothers-eastside,false,brewery
91e31189-89a4-4035-8357-4bef95a15455,Fortnight Brewing,Brewery,Cary,NC,https://www.fortnightbrewing.com,919-373-1161,4.2,false,false,"[""Brewery"",""Music Venue""]",2025-10-08 18:39:15.619611+00,2025-11-03 00:14:36.817891+00,Craft brewery with outdoor space hosting live music.,"[""singer songwriter""]",75,150,info@fortnightbrewing.com,true,fortnight-brewing,false,brewery
b6e10b6b-21b0-48a5-afff-e87933eaa09f,Bond Bros.,Brewery,Cary,NC,https://www.bondbrothersbeer.com,919-342-2739,4.4,false,false,"[""Brewery"",""Music Venue""]",2025-10-08 18:39:15.619611+00,2025-11-03 00:14:36.817891+00,Original Bond Brothers location with live music and food trucks.,"[""singer songwriter""]",100,200,events@bondbrothersbeer.com,true,bond-bros,false,brewery
edded298-bd35-4601-b51c-2f7f40c276e3,Fridays on the Front Porch (Carolina Inn),Hotel Venue,Chapel Hill,NC,https://www.carolinainn.com,919-918-2777,4.5,false,false,"[""Hotel"",""Event Space"",""Music Venue""]",2025-10-08 18:39:15.619611+00,2025-11-03 00:14:36.817891+00,Weekly outdoor concert series at historic Carolina Inn.,"[""singer songwriter""]",100,200,events@carolinainn.com,true,fridays-on-the-front-porch-carolina-inn,false,venue
4ca411f7-9a97-4dcc-8f32-b0c0a5b5782b,Neighborhood Theatre,Music Venue,Charlotte,NC,https://www.neighborhoodtheatre.com,704-358-9298,4.6,false,false,"[""Music Venue"",""Concert Hall""]",2025-10-08 18:39:15.619611+00,2025-11-03 00:14:36.817891+00,Mid-sized venue in NoDa arts district hosting touring acts.,"[""original""]",700,1000,booking@neighborhoodtheatre.com,true,neighborhood-theatre,false,venue
d1d04b23-709b-46e4-a8e2-fc395779a431,Zinchouse,Music Venue,Durham,NC,https://www.zinchouse.com/,(833) 494-9463,null,false,false,"[""Live Music"",""Winery"",""Bar""]",2025-11-02 14:30:01.712314+00,2025-11-03 00:14:36.817891+00,"Experience the best of the Triangle winery and brewery good times at ZincHouse, nestled on 87 acres of vineyards and treetop views, offering adults 21+a wide beverage selection of 400+ exquisite wines, our own ZincHouse and local brewery’s craft beers, and a robust offering of bourbon and cigars. The story of our farm and vision continues and grows in 2024!

Open Wednesday – Sunday and featuring live music and food trucks, ZincHouse is the best of good times in the Triangle. See our FAQs.

Step inside one of the three floors of our main building – the ZincHouse. Or sit on the Veranda near the vineyards and take in the beauty, Next door at the beautiful Pavilion, a music stage and the Z-House of Bourbon & Cigar Bar awaits. Two smoking verandas outside the back also feature firepits and the same captivating views. Our Carriage House, nestled in privacy, hosts public dinners, tastings and events.

Our calendar is updated monthly with our live music, food trucks, ticketed events and festivals.
Welcome to ZincHouse. The Triangle areas premier destination.","[""original"",""covers""]",null,null,info@zinchouse.com,true,zinchouse,false,bar
ea448a41-3b00-4c14-a009-3a5e4791ab26,Evening Muse,Music Venue,Charlotte,NC,https://www.eveningmuse.com,704-376-3737,4.5,false,false,"[""Music Venue"",""Listening Room""]",2025-10-08 18:39:15.619611+00,2025-11-03 00:14:36.817891+00,Intimate listening room in NoDa featuring singer-songwriters and small acts.,"[""singer songwriter""]",100,150,info@eveningmuse.com,true,evening-muse,false,venue
8f4ee7e7-080a-4a1f-b523-581935a42730,Visulite Theater,Theater,Charlotte,NC,https://www.visulitetheatre.com,704-358-9200,4.5,false,false,"[""Theater"",""Music Venue""]",2025-10-08 18:39:15.619611+00,2025-11-03 00:14:36.817891+00,Historic theater in Elizabeth neighborhood hosting concerts and events.,"[""original""]",500,700,info@visulitetheatre.com,true,visulite-theater,false,venue
28a1455a-18e0-44c6-af31-ce68c1e97c84,First Street Tavern,Bar,Clayton,NC,https://www.firststreettavern.com,null,4.2,false,false,"[""Bar"",""Music Venue""]",2025-10-08 18:39:15.619611+00,2025-11-03 00:14:36.817891+00,Local tavern featuring live music and community events.,"[""singer songwriter""]",75,150,info@firststreettavern.com,true,first-street-tavern,false,bar
833489c6-fe21-4a9f-a1ac-fafdbfa1dc54,Boatyard,Restaurant,Cornelius,NC,https://www.boatyardlkn.com,704-896-9266,4.3,false,false,"[""Restaurant"",""Music Venue""]",2025-10-08 18:39:15.619611+00,2025-11-03 00:14:36.817891+00,Lakeside restaurant and bar with live music on the waterfront.,"[""covers""]",100,200,events@boatyardlkn.com,true,boatyard,false,venue
920b8d80-7929-4f26-8950-85c3c5bd9acd,Clouds Brewing,Brewery,Durham,NC,https://www.cloudsbrewing.com,919-682-2568,4.4,false,false,"[""Brewery"",""Music Venue""]",2025-10-08 18:39:15.619611+00,2025-11-03 00:14:36.817891+00,Downtown Durham brewery with regular live music and food options.,"[""singer songwriter""]",100,200,info@cloudsbrewing.com,true,clouds-brewing,false,brewery
9c1aaef3-fd5a-430b-9cbf-4eb937d0c959,Durham Beer Garden,Beer Garden,Durham,NC,https://www.durhambeergarden.com,null,4.3,false,false,"[""Beer Garden"",""Music Venue""]",2025-10-08 18:39:15.619611+00,2025-11-03 00:14:36.817891+00,Outdoor beer garden with live music and rotating food trucks.,"[""singer songwriter""]",150,300,info@durhambeergarden.com,true,durham-beer-garden,false,venue
404ed402-2ec3-4fdb-9ec5-9b94c8ea925d,Growler Grlz,Bar,Durham,NC,https://www.growlergrlz.com,null,4.2,false,false,"[""Bar"",""Bottle Shop"",""Music Venue""]",2025-10-08 18:39:15.619611+00,2025-11-03 00:14:36.817891+00,Craft beer bar and bottle shop with live music events.,"[""singer songwriter""]",50,100,info@growlergrlz.com,true,growler-grlz,false,bar
c825222c-2c19-4a8e-b830-0235cdd4435c,Glass Jug Beer Lab,Brewery,Durham,NC,https://www.glassjugbeerlab.com,919-680-8466,4.3,false,false,"[""Brewery"",""Music Venue""]",2025-10-08 18:39:15.619611+00,2025-11-03 00:14:36.817891+00,Craft brewery in downtown Durham hosting live music and events.,"[""original"",""singer songwriter""]",75,150,events@glassjugbeerlab.com,true,glass-jug-beer-lab,false,brewery
6d8354e1-5b8b-4490-a44b-64c1161aa055,Mason Jar Lager Company,Brewery,Fuquay-Varina,NC,https://www.masonjarlagers.com,919-552-0550,4.3,false,false,"[""Brewery"",""Music Venue""]",2025-10-08 18:39:15.619611+00,2025-11-03 00:14:36.817891+00,Lager-focused brewery with outdoor space for live music.,"[""singer songwriter""]",100,200,events@masonjarlagers.com,true,mason-jar-lager-company,false,brewery
bb4ecd4e-cd58-4532-ba92-83bc6e2d7efa,Dirty Dan's Bar,Bar,Greensboro,NC,https://www.facebook.com/dirtydansbar,null,4.2,false,false,"[""Bar"",""Music Venue""]",2025-10-08 18:39:15.619611+00,2025-11-03 00:14:36.817891+00,Dive bar and music venue hosting local and touring acts.,"[""original""]",150,250,booking@dirtydansbar.com,true,dirty-dans-bar,false,bar
3d4696ac-e750-4e27-a41e-454f6eddab40,Flat Iron,Music Venue,Greensboro,NC,https://www.flatirongreensboro.com,null,4.3,false,false,"[""Music Venue"",""Bar""]",2025-10-08 18:39:15.619611+00,2025-11-03 00:14:36.817891+00,Downtown Greensboro venue featuring local and regional music.,"[""original""]",150,250,booking@flatirongreensboro.com,true,flat-iron,false,bar
4d123bd8-372e-42e5-8851-2b28cd407c9a,The Grand GSO,Theater,Greensboro,NC,https://www.thegrandgso.com,336-272-4663,4.6,false,false,"[""Theater"",""Music Venue""]",2025-10-08 18:39:15.619611+00,2025-11-03 00:14:36.817891+00,Historic theater in downtown Greensboro hosting concerts and events.,"[""tribute""]",800,1000,info@thegrandgso.com,true,the-grand-gso,false,venue
313c31a1-4d73-40c0-9ff5-229c67879ea6,Pantana Bob's,Bar,Greenville,NC,https://www.pantanabobs.com,252-757-1777,4.2,false,false,"[""Bar"",""Music Venue""]",2025-10-08 18:39:15.619611+00,2025-11-03 00:14:36.817891+00,College town bar featuring live music and DJ nights.,"[""covers""]",200,350,info@pantanabobs.com,true,pantana-bobs,false,bar
56b8be49-3427-4c85-a128-755c378c5fe0,AJ McMurphy's,Bar & Grill,Greenville,NC,https://www.ajmcmurphys.com,252-551-9627,4.3,false,false,"[""Bar"",""Restaurant"",""Music Venue""]",2025-10-08 18:39:15.619611+00,2025-11-03 00:14:36.817891+00,Irish pub and restaurant with live music on weekends.,"[""singer songwriter"",""covers""]",150,250,info@ajmcmurphys.com,true,aj-mcmurphys,false,bar
2bde05f1-7e65-4177-85a6-80b4bd709422,Dirtbag Ales,Brewery,Hope Mills,NC,https://www.dirtbagales.com,910-426-9016,4.4,false,false,"[""Brewery"",""Music Venue""]",2025-10-08 18:39:15.619611+00,2025-11-03 00:14:36.817891+00,Craft brewery with outdoor space hosting live music and food trucks.,"[""singer songwriter""]",100,200,events@dirtbagales.com,true,dirtbag-ales,false,brewery
ba5bb92d-5256-4208-90bc-1ff5d69f3fa7,The Brown Pelican,Bar,New Bern,NC,https://www.thebrownpelican.com,252-637-2525,4.3,false,false,"[""Bar"",""Music Venue""]",2025-10-08 18:39:15.619611+00,2025-11-03 00:14:36.817891+00,Waterfront bar featuring live music and outdoor seating.,"[""singer songwriter""]",100,200,info@thebrownpelican.com,true,the-brown-pelican,false,bar
1e9a9ca9-8246-48bd-8d86-81ba0669ab76,Baxter's 1892,Restaurant,New Bern,NC,https://www.baxters1892.com,252-638-5595,4.4,false,false,"[""Restaurant"",""Music Venue""]",2025-10-08 18:39:15.619611+00,2025-11-03 00:14:36.817891+00,Historic restaurant and bar with live music in downtown New Bern.,"[""singer songwriter""]",75,150,info@baxters1892.com,true,baxters-1892,false,venue
744ff280-1203-4348-8a14-8e8d930ca0f5,Drum and Quill,Music Venue,Pinehurst,NC,https://www.drumandquill.com,null,4.3,false,false,"[""Music Venue"",""Bar""]",2025-10-08 18:39:15.619611+00,2025-11-03 00:14:36.817891+00,Intimate venue in historic Pinehurst hosting singer-songwriters and small acts.,"[""singer songwriter""]",75,125,booking@drumandquill.com,true,drum-and-quill,false,bar
872e5188-ff92-46bd-bac7-3e5cb8d6fa57,BMC Brewing,Brewery,Pittsboro,NC,https://www.bmcbrewing.com,919-533-9977,4.3,false,false,"[""Brewery"",""Music Venue""]",2025-10-08 18:39:15.619611+00,2025-11-03 00:14:36.817891+00,Craft brewery with live music and food truck events.,"[""singer songwriter""]",75,150,events@bmcbrewing.com,true,bmc-brewing,false,brewery
8395fa7b-9a94-4397-ac1d-2ceafa7e0265,Bowstring,Music Venue,Raleigh,NC,https://www.bowstringraleigh.com,919-803-0520,4.5,false,false,"[""Music Venue"",""Bar""]",2025-10-08 18:39:15.619611+00,2025-11-03 00:14:36.817891+00,Intimate music venue in downtown Raleigh featuring singer-songwriters.,"[""singer songwriter""]",100,150,booking@bowstringraleigh.com,true,bowstring,false,bar
40cc6872-c4eb-44ba-80a2-e12e81be858c,Compass Rose Brewery,Brewery,Raleigh,NC,https://www.compassrosebrewery.com,919-803-2290,4.3,false,false,"[""Brewery"",""Music Venue""]",2025-10-08 18:39:15.619611+00,2025-11-03 00:14:36.817891+00,Craft brewery in North Raleigh with live music events.,"[""singer songwriter""]",100,200,events@compassrosebrewery.com,true,compass-rose-brewery,false,brewery
09e9a0a1-d663-43cc-afe6-11d9391b2cfb,Tap Yard,Beer Garden,Raleigh,NC,https://www.tapyardraleigh.com,null,4.3,false,false,"[""Beer Garden"",""Music Venue""]",2025-10-08 18:39:15.619611+00,2025-11-03 00:14:36.817891+00,Outdoor beer garden and event space with live music.,"[""covers""]",200,400,events@tapyardraleigh.com,true,tap-yard,false,venue
e98cbb9e-dd53-4b8b-b13a-54b59f951ae8,Gizmo Brew Works,Brewery,Raleigh,NC,https://www.gizmobrewworks.com,919-251-9381,4.4,false,false,"[""Brewery"",""Music Venue""]",2025-10-08 18:39:15.619611+00,2025-11-03 00:14:36.817891+00,Craft brewery in Five Points with regular live music.,"[""original"",""singer songwriter""]",100,200,events@gizmobrewworks.com,true,gizmo-brew-works,false,brewery
1c344467-6d2f-4d03-a709-347d08f0f0a9,Raleigh Brewing Company,Brewery,Raleigh,NC,https://www.raleighbrewingcompany.com,919-803-7887,4.4,false,false,"[""Brewery"",""Music Venue""]",2025-10-08 18:39:15.619611+00,2025-11-03 00:14:36.817891+00,Craft brewery with outdoor beer garden hosting live music.,"[""singer songwriter""]",150,300,events@raleighbrewingcompany.com,true,raleigh-brewing-company,false,brewery
8148acde-4e35-4503-8e59-cb2cdcc9f653,Transfer Co Ballroom,Music Venue,Raleigh,NC,https://www.transfercoballroom.com,919-900-5070,4.7,false,false,"[""Music Venue"",""Event Space""]",2025-10-08 18:39:15.619611+00,2025-11-03 00:14:36.817891+00,Historic ballroom venue in downtown Raleigh hosting concerts and events.,"[""original""]",700,900,booking@transfercoballroom.com,true,transfer-co-ballroom,false,venue
f1b512d7-c9cd-4d6f-954e-ea207dd471cb,Westin Raleigh (Rooftop),Hotel Venue,Raleigh,NC,https://www.marriott.com/hotels/travel/rduwi-the-westin-raleigh-durham-airport-brier-creek,null,4.3,false,false,"[""Hotel"",""Rooftop Venue""]",2025-10-08 18:39:15.619611+00,2025-11-03 00:14:36.817891+00,Rooftop venue at downtown Westin hotel with live music events.,"[""singer songwriter""]",100,200,events@westinraleigh.com,true,westin-raleigh-rooftop,false,venue
6bc94c59-4a2f-48e8-b59f-60563c083852,Blackbird Beer,Bar,Raleigh,NC,https://www.blackbirdraleigh.com,null,4.3,false,false,"[""Bar"",""Beer Garden"",""Music Venue""]",2025-10-08 18:39:15.619611+00,2025-11-03 00:14:36.817891+00,Beer garden and bar with live music in downtown Raleigh.,"[""original"",""singer songwriter""]",100,200,info@blackbirdraleigh.com,true,blackbird-beer,false,bar
88cc8f0d-41d5-4d8d-8a5c-148d03de76a5,Lincoln Theatre,Theater,Raleigh,NC,https://www.lincolntheatre.com,919-821-4111,4.6,false,false,"[""Theater"",""Music Venue""]",2025-10-08 18:39:15.619611+00,2025-11-03 00:14:36.817891+00,Historic theater on Wilmington Street hosting concerts and performing arts.,"[""tribute""]",500,700,info@lincolntheatre.com,true,lincoln-theatre,false,venue
f19f5157-c28c-49a9-a3d5-43f0b0cfb6df,The Pour House,Music Venue,Raleigh,NC,https://www.thepourhousemusichall.com,919-821-1120,4.5,false,false,"[""Music Venue"",""Bar""]",2025-10-08 18:39:15.619611+00,2025-11-03 00:14:36.817891+00,Long-running Raleigh venue hosting rock and alternative acts.,"[""original""]",400,600,booking@thepourhousemusichall.com,true,the-pour-house,false,bar
456a3926-3155-4dc7-a939-4e2951c19a52,Rocky Mount Mills,Event Space,Rocky Mount,NC,https://www.rockymountmills.com,252-883-1140,4.5,false,false,"[""Event Space"",""Music Venue""]",2025-10-08 18:39:15.619611+00,2025-11-03 00:14:36.817891+00,Historic mill complex hosting concerts and community events.,"[""singer songwriter""]",300,500,events@rockymountmills.com,true,rocky-mount-mills,false,venue
3c32d910-3550-4307-86cb-e4aa58a9edcd,White Street Brewing,Brewery,Wake Forest,NC,https://www.whitestreetbrewing.com,919-570-9700,4.3,false,false,"[""Brewery"",""Music Venue""]",2025-10-08 18:39:15.619611+00,2025-11-03 00:14:36.817891+00,Downtown Wake Forest brewery with live music and food trucks.,"[""singer songwriter""]",100,200,events@whitestreetbrewing.com,true,white-street-brewing,false,brewery
f193e671-63cb-428c-8d03-838222938e17,Real McCoy's,Bar,Wake Forest,NC,https://www.realmccoyswf.com,null,4.2,false,false,"[""Bar"",""Music Venue""]",2025-10-08 18:39:15.619611+00,2025-11-03 00:14:36.817891+00,Bar and grill featuring live music on weekends.,"[""covers""]",100,200,info@realmccoyswf.com,true,real-mccoys,false,bar
1c55bdce-bb4a-4251-a7c7-ce0756c834c9,The Mulberry House,Restaurant,Washington,NC,https://www.themulberryhousenc.com,null,4.4,false,false,"[""Restaurant"",""Music Venue""]",2025-10-08 18:39:15.619611+00,2025-11-03 00:14:36.817891+00,Historic restaurant featuring live music in downtown Washington.,"[""singer songwriter""]",75,125,info@themulberryhousenc.com,true,the-mulberry-house,false,venue
12dcd823-5aa5-420d-8b72-ad6516246d3f,Bearded Bee Brewing,Brewery,Wendell,NC,https://www.beardedbeebrewing.com,919-404-9663,4.4,false,false,"[""Brewery"",""Music Venue""]",2025-10-08 18:39:15.619611+00,2025-11-03 00:14:36.817891+00,Craft brewery with outdoor space hosting live music events.,"[""singer songwriter""]",100,200,events@beardedbeebrewing.com,true,bearded-bee-brewing,false,brewery
6af4038a-fe49-4911-9c66-8cd8df469286,The Ramkat,Music Venue,Winston-Salem,NC,https://www.theramkat.com,336-793-0700,4.6,false,false,"[""Music Venue"",""Concert Hall""]",2025-10-08 18:39:15.619611+00,2025-11-03 00:14:36.817891+00,Premier music venue in Winston-Salem hosting national and regional acts.,"[""original""]",700,900,booking@theramkat.com,true,the-ramkat,false,venue
dab1217f-f3d1-4f6a-9b1e-9bed83a2ab25,Ziggy's,Music Venue,Winston-Salem,NC,https://www.ziggysrocks.com,336-480-8326,4.5,false,false,"[""Music Venue"",""Bar""]",2025-10-08 18:39:15.619611+00,2025-11-03 00:14:36.817891+00,Legendary Winston-Salem venue featuring rock and alternative music.,"[""original""]",500,700,booking@ziggysrocks.com,true,ziggys,false,bar
72771cdc-87e6-4e5e-bd47-acafeb582129,The Birchmere,Music Venue,Alexandria,VA,https://www.birchmere.com,703-549-7500,4.7,false,false,"[""Music Venue"",""Concert Hall""]",2025-10-08 18:39:15.619611+00,2025-11-03 00:14:36.817891+00,"Legendary listening room and concert hall hosting folk, Americana, and roots music.","[""singer songwriter""]",500,600,booking@birchmere.com,true,the-birchmere,false,venue
0e759b0e-15b3-48e6-a5f2-7c2053e75646,Tally Ho Theater,Theater,Leesburg,VA,https://www.tallyhotheater.com,703-687-6464,4.4,false,false,"[""Theater"",""Music Venue""]",2025-10-08 18:39:15.619611+00,2025-11-03 00:14:36.817891+00,Historic downtown Leesburg theater hosting concerts and films.,"[""singer songwriter""]",250,300,info@tallyhotheater.com,true,tally-ho-theater,false,venue
e18547df-bbad-4cca-b958-7062ba2276cd,Nova Live,Music Venue,Manassas,VA,https://www.novalive.com,null,4.4,false,false,"[""Music Venue"",""Concert Hall""]",2025-10-08 18:39:15.619611+00,2025-11-03 00:14:36.817891+00,Northern Virginia venue hosting rock and alternative acts.,"[""original""]",400,600,booking@novalive.com,true,nova-live,false,venue
0a93b661-13b3-41a0-90cf-8b6d8e4ae4d6,The Tin Pan,Music Venue,Richmond,VA,https://www.thetinpanrva.com,804-447-8189,4.4,false,false,"[""Music Venue"",""Bar""]",2025-10-08 18:39:15.619611+00,2025-11-03 00:14:36.817891+00,Intimate venue in Carytown hosting local and touring acts.,"[""original""]",150,250,booking@thetinpanrva.com,true,the-tin-pan,false,bar
a30d797f-0ca9-4dbc-88d5-6d22822fbf37,The Canal Club,Music Venue,Richmond,VA,https://www.thecanalclub.com,804-643-2582,4.5,false,false,"[""Music Venue"",""Concert Hall""]",2025-10-08 18:39:15.619611+00,2025-11-03 00:14:36.817891+00,Historic Richmond venue in Shockoe Bottom hosting rock and alternative music.,"[""original""]",500,700,booking@thecanalclub.com,true,the-canal-club,false,venue
10980247-c217-470a-b246-8f9e5df76c37,Ember Music Hall,Music Venue,Richmond,VA,https://www.embermusichall.com,804-592-1602,4.6,false,false,"[""Music Venue"",""Concert Hall""]",2025-10-08 18:39:15.619611+00,2025-11-03 00:14:36.817891+00,Modern music venue in Richmond hosting diverse acts and events.,"[""original""]",600,800,booking@embermusichall.com,true,ember-music-hall,false,venue
0ae7283b-5b81-49ff-8f20-6f65457d398c,Jamming Java,Coffee Shop,Vienna,VA,https://www.jammingjava.com,703-255-1566,4.5,false,false,"[""Coffee Shop"",""Music Venue""]",2025-10-08 18:39:15.619611+00,2025-11-03 00:14:36.817891+00,Coffee house and listening room featuring singer-songwriters and small acts.,"[""singer songwriter""]",100,150,booking@jammingjava.com,true,jamming-java,false,venue
76972eed-82ff-44b5-8776-0517bb9f0615,Elevation 27,Music Venue,Virginia Beach,VA,https://www.elevation27.com,null,4.4,false,false,"[""Music Venue"",""Bar""]",2025-10-08 18:39:15.619611+00,2025-11-03 00:14:36.817891+00,Virginia Beach venue hosting rock and alternative music.,"[""original""]",300,500,booking@elevation27.com,true,elevation-27,false,bar
7de53a9a-c8b8-4284-83ee-ec017d33e653,Believe Music Hall,Music Venue,Atlanta,GA,https://www.believemusichall.com,null,4.5,false,false,"[""Music Venue"",""Concert Hall""]",2025-10-08 18:39:15.619611+00,2025-11-03 00:14:36.817891+00,Atlanta music venue hosting rock and alternative acts.,"[""original""]",800,1000,booking@believemusichall.com,true,believe-music-hall,false,venue
d599f468-64f9-4ec6-8b3f-8ac373887ef5,The Wormhole,Music Venue,Savannah,GA,https://www.thewormholesavannah.com,null,4.3,false,false,"[""Music Venue"",""Bar""]",2025-10-08 18:39:15.619611+00,2025-11-03 00:14:36.817891+00,"Dive bar and music venue hosting punk, metal, and alternative acts.","[""original""]",150,250,booking@thewormholesav.com,true,the-wormhole,false,bar
ace7af96-f59d-4e2f-9ffb-3eba2c4c320a,Madlife Stage and Studios,Music Venue,Woodstock,GA,https://www.madlifestageandstudios.com,678-494-4313,4.5,false,false,"[""Music Venue"",""Recording Studio""]",2025-10-08 18:39:15.619611+00,2025-11-03 00:14:36.817891+00,Venue and recording studio complex north of Atlanta.,"[""original""]",400,600,booking@madlifestageandstudios.com,true,madlife-stage-and-studios,false,venue
297917c6-d6f9-43ad-a9cb-c3881726be3f,Common House,Private Club,Chattanooga,TN,https://www.commonhousesocial.com,null,4.4,false,false,"[""Private Club"",""Music Venue""]",2025-10-08 18:39:15.619611+00,2025-11-03 00:14:36.817891+00,Members-only social club hosting private concerts and events.,"[""singer songwriter""]",100,200,events@commonhousesocial.com,true,common-house,false,venue
